{
  "$schema": "./routing-matrix.schema.json",
  "schemaVersion": 1,
  "source": {
    "repository": "https://github.com/cameronsjo/spec-compare",
    "path": "docs/use-case-scoring.md",
    "ref": "main",
    "transcribedAt": "2026-07-03",
    "notes": [
      "Decision tree: modification prefers OpenSpec-style deltas; small greenfield prefers Spec-Kit-style full planning; large parallel work prefers Spec Kitty-style orchestration; emergencies and unclear experiments skip SDD.",
      "Council routes adapt those choices to direct, delta, full, and program orchestration while preserving plan-only behavior."
    ]
  },
  "dimensions": {
    "size": ["trivial", "small", "medium", "large", "program"],
    "landscape": ["brownfield", "greenfield"],
    "kind": [
      "ui-tweak",
      "bugfix",
      "hotfix",
      "refactor",
      "api",
      "feature",
      "cross-cutting",
      "maintenance",
      "design-system",
      "prototype"
    ],
    "risk": ["low", "medium", "high", "critical"],
    "clarity": ["clear", "needs-questions", "unclear"],
    "parallelism": ["none", "some", "high"]
  },
  "useCaseScores": [
    {
      "id": "trivial-modification",
      "category": "trivial",
      "best": ["OpenSpec"],
      "avoid": ["BMad", "Kiro"],
      "scores": { "OpenSpec": 5, "Spec-Kit": 3, "Spec Kitty": 2, "BMad": 1, "Kiro": 2, "Tessl": 4 }
    },
    {
      "id": "greenfield-feature",
      "category": "large",
      "best": ["Spec-Kit", "BMad"],
      "avoid": ["OpenSpec"],
      "scores": { "OpenSpec": 3, "Spec-Kit": 5, "Spec Kitty": 4, "BMad": 5, "Kiro": 4, "Tessl": 3 }
    },
    {
      "id": "medium-refactor",
      "category": "medium",
      "best": ["OpenSpec"],
      "avoid": ["BMad"],
      "scores": { "OpenSpec": 5, "Spec-Kit": 4, "Spec Kitty": 3, "BMad": 2, "Kiro": 3, "Tessl": 4 }
    },
    {
      "id": "production-bug",
      "category": "emergency",
      "best": ["OpenSpec", "None"],
      "avoid": ["BMad", "Kiro"],
      "scores": { "OpenSpec": 4, "Spec-Kit": 2, "Spec Kitty": 2, "BMad": 1, "Kiro": 1, "Tessl": 3, "None": 4 }
    },
    {
      "id": "api-endpoint",
      "category": "large",
      "best": ["BMad"],
      "avoid": ["OpenSpec"],
      "scores": { "OpenSpec": 3, "Spec-Kit": 4, "Spec Kitty": 3, "BMad": 5, "Kiro": 3, "Tessl": 4 }
    },
    {
      "id": "parallel-features",
      "category": "parallel",
      "best": ["Spec Kitty"],
      "avoid": ["Spec-Kit"],
      "scores": { "OpenSpec": 3, "Spec-Kit": 2, "Spec Kitty": 5, "BMad": 2, "Kiro": 2, "Tessl": 2 }
    },
    {
      "id": "cross-cutting-change",
      "category": "medium",
      "best": ["OpenSpec"],
      "avoid": ["Kiro"],
      "scores": { "OpenSpec": 5, "Spec-Kit": 3, "Spec Kitty": 3, "BMad": 2, "Kiro": 2, "Tessl": 3 }
    },
    {
      "id": "emergency-hotfix",
      "category": "emergency",
      "best": ["None"],
      "avoid": ["OpenSpec", "Spec-Kit", "Spec Kitty", "BMad", "Kiro", "Tessl"],
      "scores": { "OpenSpec": 2, "Spec-Kit": 1, "Spec Kitty": 1, "BMad": 1, "Kiro": 1, "Tessl": 1, "None": 5 }
    },
    {
      "id": "design-system",
      "category": "large",
      "best": ["Spec-Kit", "BMad"],
      "avoid": ["Tessl"],
      "scores": { "OpenSpec": 3, "Spec-Kit": 5, "Spec Kitty": 4, "BMad": 5, "Kiro": 3, "Tessl": 2 }
    },
    {
      "id": "experimental-prototype",
      "category": "unclear",
      "best": ["None"],
      "avoid": ["BMad"],
      "scores": { "OpenSpec": 3, "Spec-Kit": 2, "Spec Kitty": 2, "BMad": 1, "Kiro": 3, "Tessl": 2, "None": 5 }
    },
    {
      "id": "dependency-update",
      "category": "medium",
      "best": ["OpenSpec"],
      "avoid": ["BMad"],
      "scores": { "OpenSpec": 4, "Spec-Kit": 3, "Spec Kitty": 2, "BMad": 2, "Kiro": 2, "Tessl": 3 }
    },
    {
      "id": "solo-side-project",
      "category": "small",
      "best": ["OpenSpec", "None"],
      "avoid": ["BMad"],
      "scores": { "OpenSpec": 4, "Spec-Kit": 3, "Spec Kitty": 2, "BMad": 1, "Kiro": 3, "Tessl": 2, "None": 4 }
    }
  ],
  "routeProfiles": [
    {
      "route": "direct",
      "basis": "No SDD/direct-code path adapted to council as a single minimal task DAG.",
      "dagShape": "single-minimal-task",
      "planExecutesWorkers": false,
      "stageTiers": {
        "grill": "haiku",
        "survey": "skip",
        "plan": "haiku",
        "critique": "skip",
        "consolidate": "haiku",
        "tasking": "haiku",
        "verify": "haiku"
      }
    },
    {
      "route": "delta",
      "basis": "OpenSpec-style modification path for brownfield deltas.",
      "dagShape": "delta-task-dag",
      "planExecutesWorkers": false,
      "stageTiers": {
        "grill": "haiku",
        "survey": "haiku",
        "plan": "sonnet",
        "critique": "haiku",
        "consolidate": "sonnet",
        "tasking": "haiku",
        "verify": "sonnet"
      }
    },
    {
      "route": "full",
      "basis": "Spec-Kit/BMad-style full planning for greenfield or architecture-heavy work.",
      "dagShape": "full-task-dag",
      "planExecutesWorkers": false,
      "stageTiers": {
        "grill": "sonnet",
        "survey": "sonnet",
        "plan": "opus",
        "critique": "sonnet",
        "consolidate": "opus",
        "tasking": "sonnet",
        "verify": "sonnet"
      }
    },
    {
      "route": "program",
      "basis": "Spec Kitty-style parallel orchestration for large multi-agent programs.",
      "dagShape": "parallel-program-dag",
      "planExecutesWorkers": false,
      "stageTiers": {
        "grill": "sonnet",
        "survey": "opus",
        "plan": "opus",
        "critique": "opus",
        "consolidate": "opus",
        "tasking": "sonnet",
        "verify": "sonnet"
      }
    }
  ],
  "routeRules": [
    {
      "id": "critical-hotfix-direct",
      "route": "direct",
      "reason": "Emergency hotfixes should skip SDD and document after the immediate repair.",
      "useCaseRefs": ["emergency-hotfix", "production-bug"],
      "when": { "kind": ["hotfix"], "risk": ["critical"] }
    },
    {
      "id": "trivial-clear-direct",
      "route": "direct",
      "reason": "A trivial, clear, low-risk change should not fan out planning overhead.",
      "useCaseRefs": ["trivial-modification", "solo-side-project"],
      "when": {
        "size": ["trivial"],
        "kind": ["ui-tweak", "bugfix", "maintenance"],
        "risk": ["low"],
        "clarity": ["clear"],
        "parallelism": ["none"]
      }
    },
    {
      "id": "prototype-direct",
      "route": "direct",
      "reason": "Unclear prototypes should explore cheaply before a heavier SDD route exists.",
      "useCaseRefs": ["experimental-prototype"],
      "when": {
        "size": ["trivial", "small"],
        "kind": ["prototype"],
        "risk": ["low", "medium"],
        "clarity": ["unclear"]
      }
    },
    {
      "id": "high-parallel-program",
      "route": "program",
      "reason": "High parallelism needs explicit program-level orchestration and collision control.",
      "useCaseRefs": ["parallel-features"],
      "when": { "parallelism": ["high"] }
    },
    {
      "id": "program-scale",
      "route": "program",
      "reason": "Program-sized work needs staged coordination even without explicit parallel demand.",
      "useCaseRefs": ["parallel-features", "design-system"],
      "when": { "size": ["program"] }
    },
    {
      "id": "large-high-risk-program",
      "route": "program",
      "reason": "Large high-risk work should be decomposed and governed as a program.",
      "useCaseRefs": ["design-system", "greenfield-feature"],
      "when": { "size": ["large"], "risk": ["high", "critical"] }
    },
    {
      "id": "brownfield-delta",
      "route": "delta",
      "reason": "Brownfield modifications fit an OpenSpec-style delta path.",
      "useCaseRefs": [
        "trivial-modification",
        "medium-refactor",
        "production-bug",
        "cross-cutting-change",
        "dependency-update"
      ],
      "when": {
        "landscape": ["brownfield"],
        "kind": ["ui-tweak", "bugfix", "refactor", "cross-cutting", "maintenance"]
      }
    },
    {
      "id": "greenfield-full",
      "route": "full",
      "reason": "Greenfield features need full specification, planning, and task generation.",
      "useCaseRefs": ["greenfield-feature", "api-endpoint", "design-system"],
      "when": { "landscape": ["greenfield"] }
    },
    {
      "id": "architecture-full",
      "route": "full",
      "reason": "API, feature, and design-system work usually needs architecture-level planning.",
      "useCaseRefs": ["api-endpoint", "design-system", "greenfield-feature"],
      "when": { "kind": ["api", "feature", "design-system"] }
    },
    {
      "id": "fallback-delta",
      "route": "delta",
      "reason": "Unknown brownfield work defaults to a delta route.",
      "useCaseRefs": ["medium-refactor"],
      "when": { "landscape": ["brownfield"] }
    },
    {
      "id": "fallback-full",
      "route": "full",
      "reason": "Unknown work defaults to full planning.",
      "useCaseRefs": ["greenfield-feature"],
      "when": {}
    }
  ],
  "stageAdjustments": [
    {
      "id": "clarity-needs-grill",
      "reason": "Unresolved questions should spend more tier on grill before planning.",
      "when": { "clarity": ["needs-questions"] },
      "minTiers": { "grill": "sonnet" }
    },
    {
      "id": "unclear-grill",
      "reason": "Unclear requirements require a stronger exploration pass.",
      "when": { "clarity": ["unclear"] },
      "minTiers": { "grill": "opus", "survey": "sonnet" }
    },
    {
      "id": "high-risk-review",
      "reason": "High risk raises planning and verification tiers.",
      "when": { "risk": ["high", "critical"] },
      "minTiers": { "plan": "opus", "consolidate": "opus", "verify": "sonnet" }
    },
    {
      "id": "some-parallelism",
      "reason": "Parallel execution needs stronger decomposition and consolidation.",